ticker,date,source,title,description,url,content,text,sentiment
Nvidia,2025-05-09,Business Insider,Nvidia-backed Israeli AI startup AI21 is raising a $300 million funding round,"AI21, an Israeli startup building its own large language models (LLMs), is raising a $300 million funding round, according to a source.",https://www.businessinsider.com/llm-startup-ai21-is-raising-a-300-million-funding-round-2025-5,"AI21's founders from left to right: Ori Goshen, Amnon Shashua and Yoav Shoham.Roei Shor
<ul><li>AI21 is raising a $300 million Series D funding round to build its own LLMs.</li><li>AI21 aims to redu… [+1904 chars]","Nvidia-backed Israeli AI startup AI21 is raising a $300 million funding round AI21, an Israeli startup building its own large language models (LLMs), is raising a $300 million funding round, according to a source.",0.8823816515505314
Nvidia,2025-05-09,Tom's Hardware UK,Nvidia readies cut-down HGX H20 GPU for China to comply with export control rules,"Nvidia plans to launch a downgraded HGX H20 AI processor with reduced HBM memory capacity for China by July to comply with new U.S. export rules, if a new rumor is correct.",https://www.tomshardware.com/tech-industry/artificial-intelligence/nvidia-readies-cut-down-hgx-h20-gpu-for-china-to-comply-with-export-control-rules,"Nvidia plans to introduce a cut-down version of its HGX H20 AI processor in China by July, aiming to retain access to the market after U.S. officials effectively barred the original version through u… [+2468 chars]","Nvidia readies cut-down HGX H20 GPU for China to comply with export control rules Nvidia plans to launch a downgraded HGX H20 AI processor with reduced HBM memory capacity for China by July to comply with new U.S. export rules, if a new rumor is correct.",0.9946360355243087
Nvidia,2025-05-09,Biztoc.com,"Stock Market Today: Dow Jones Dips As China Tariff Talks Near; Tesla Jumps As Apple, Nvidia, Amazon Gain (Live Coverage)","Major stock indexes reversed lower Friday as traders grew more tentative about upcoming trade talks with China. All three indexes held support at a key moving average but also headed into a level of resistance as they eye their third week of gains. Meanwhile,…",https://biztoc.com/x/f3f929a03512d45e,Major stock indexes reversed lower Friday as traders grew more tentative about upcoming trade talks with China. All three indexes held support at a key moving average but also headed into a level of … [+147 chars],"Stock Market Today: Dow Jones Dips As China Tariff Talks Near; Tesla Jumps As Apple, Nvidia, Amazon Gain (Live Coverage) Major stock indexes reversed lower Friday as traders grew more tentative about upcoming trade talks with China. All three indexes held support at a key moving average but also headed into a level of resistance as they eye their third week of gains. Meanwhile,…",0.28615784645080566
Nvidia,2025-05-09,Investor's Business Daily,Alibaba Strengthens Ahead Of Results; Nvidia-Backed CoreWeave Set To Report,"Alibaba stock has the look of a turnaround story, with earnings and revenue expected to improve in coming quarters.",https://www.investors.com/research/earnings-preview/alibaba-baba-stock-nvidia-coreweave-earnings/,"Information in Investors Business Daily is for informational and educational purposes only and should not be construed as an offer, recommendation, solicitation, or rating to buy or sell securities. … [+1064 chars]","Alibaba Strengthens Ahead Of Results; Nvidia-Backed CoreWeave Set To Report Alibaba stock has the look of a turnaround story, with earnings and revenue expected to improve in coming quarters.",-0.9999999985362192
Nvidia,2025-05-09,TechSpot,Rare 1998 Nvidia Riva TNT prototype and signed lunchbox go up for auction,"A seldom-seen ""artifact"" from the early days of graphics technology is currently attracting significant interest: an original Nvidia Riva TNT engineering prototype kit, packaged with a special-edition promotional lunchbox, is now available through a Heritage …",https://www.techspot.com/news/107868-rare-1998-nvidia-riva-tnt-prototype-signed-lunchbox.html,Editor's take: An early Nvidia graphics card has surfaced at an auction drawing attention from collectors and enthusiasts. The growing fascination with tech memorabilia highlights how these once-ordi… [+2771 chars],"Rare 1998 Nvidia Riva TNT prototype and signed lunchbox go up for auction A seldom-seen ""artifact"" from the early days of graphics technology is currently attracting significant interest: an original Nvidia Riva TNT engineering prototype kit, packaged with a special-edition promotional lunchbox, is now available through a Heritage …",-0.8770023733377457
Nvidia,2025-05-09,Yahoo Entertainment,NVIDIA Corporation (NVDA): Among Chris Rokos’ Stock Picks with Huge Upside Potential,"We recently published an article titled Billionaire Chris Rokos’ 10 Stock Picks with Huge Upside Potential. In this article, we are going to take a look at...",https://finance.yahoo.com/news/nvidia-corporation-nvda-among-chris-025253438.html,"We recently published an article titled Billionaire Chris Rokos' 10 Stock Picks with Huge Upside Potential. In this article, we are going to take a look at where NVIDIA Corporation (NASDAQ:NVDA) stan… [+6592 chars]","NVIDIA Corporation (NVDA): Among Chris Rokos’ Stock Picks with Huge Upside Potential We recently published an article titled Billionaire Chris Rokos’ 10 Stock Picks with Huge Upside Potential. In this article, we are going to take a look at...",-0.9995013020816259
Tesla,2025-05-09,Business Insider,Tesla tells Model Y and Cybertruck workers to stay home for a week,The guidance comes amid a drop in deliveries and earlier slowdowns of Cybertruck production.,https://www.businessinsider.com/tesla-model-y-cybertruck-workers-stay-home-memorial-day-2025-5,"The Model Y and Cybertruck.picture alliance;NurPhoto / Getty Images
<ul><li>Tesla told workers on some Model Y and Cybertruck lines to take the week of Memorial Day off.</li><li>The company has also… [+2726 chars]",Tesla tells Model Y and Cybertruck workers to stay home for a week The guidance comes amid a drop in deliveries and earlier slowdowns of Cybertruck production.,-1.1500509700113071e-07
Tesla,2025-05-09,Quartz India,A key Tesla supplier is slashing jobs,"Japanese electronics giant Panasonic, Tesla’s (TSLA) original battery supplier and one of its largest, announced today that it will lay off almost 5% of its workforce: 5,000 workers domestically and 5,000 globally. The layoffs will take place between now and …",https://qz.com/panasonic-tesla-battery-supplier-layoffs-jobs-1851779966,"In This Story
Japanese electronics giant Panasonic, Teslas (TSLA)original battery supplier and one of its largest, announced today that it will lay off almost 5% of its workforce: 5,000 workers dome… [+1695 chars]","A key Tesla supplier is slashing jobs Japanese electronics giant Panasonic, Tesla’s (TSLA) original battery supplier and one of its largest, announced today that it will lay off almost 5% of its workforce: 5,000 workers domestically and 5,000 globally. The layoffs will take place between now and …",0.987543641764205
Tesla,2025-05-09,Biztoc.com,"Stock Market Today: Dow Jones Dips As China Tariff Talks Near; Tesla Jumps As Apple, Nvidia, Amazon Gain (Live Coverage)","Major stock indexes reversed lower Friday as traders grew more tentative about upcoming trade talks with China. All three indexes held support at a key moving average but also headed into a level of resistance as they eye their third week of gains. Meanwhile,…",https://biztoc.com/x/f3f929a03512d45e,Major stock indexes reversed lower Friday as traders grew more tentative about upcoming trade talks with China. All three indexes held support at a key moving average but also headed into a level of … [+147 chars],"Stock Market Today: Dow Jones Dips As China Tariff Talks Near; Tesla Jumps As Apple, Nvidia, Amazon Gain (Live Coverage) Major stock indexes reversed lower Friday as traders grew more tentative about upcoming trade talks with China. All three indexes held support at a key moving average but also headed into a level of resistance as they eye their third week of gains. Meanwhile,…",0.28615784645080566
Tesla,2025-05-09,Bringatrailer.com,2013 Tesla Model S 85 at No Reserve,This 2013 Tesla Model S 85 was purchased new by the seller and now has 47k miles following history in Massachusetts. The sedan is finished in Green Metallic over Black leather and is powered by a three-phase AC induction motor paired with a single-speed direc…,https://bringatrailer.com/listing/2013-tesla-model-s-13/,This 2013 Tesla Model S 85 was purchased new by the seller and now has 47k miles following history in Massachusetts. The sedan is finished in Green Metallic over Black leather and is powered by a thr… [+1794 chars],2013 Tesla Model S 85 at No Reserve This 2013 Tesla Model S 85 was purchased new by the seller and now has 47k miles following history in Massachusetts. The sedan is finished in Green Metallic over Black leather and is powered by a three-phase AC induction motor paired with a single-speed direc…,0.9999974976928456
Tesla,2025-05-09,Yahoo Entertainment,Tesla Shares Climb on Hopes of U.S.-China Trade Breakthrough,Tesla Extends 30% Rally Amid Investor Bets on Positive China Trade Talks,https://finance.yahoo.com/news/tesla-shares-climb-hopes-u-184921879.html,"Tesla (NASDAQ:TSLA) shares surged about 5% on Friday as investors cheered signs of renewed executive focus and improving U.S.-China trade sentiment, despite recent weakness in the electric vehicle ma… [+1122 chars]",Tesla Shares Climb on Hopes of U.S.-China Trade Breakthrough Tesla Extends 30% Rally Amid Investor Bets on Positive China Trade Talks,-0.999999638537787
Tesla,2025-05-09,Next Big Future,Strategic Importance of Tesla Dojo Chips and 4680 Batteries,"Tesla and Elon continue to develop 4680 batteries, AI4 and AI5 inference chips and Tesla Dojo chips. I have projected that Tesla could get trillions in value from cracking making Dojo chips being broadly useful for xAI for large language model training. 4680 …",https://www.nextbigfuture.com/2025/05/strategic-importance-of-tesla-dojo-chips-and-4680-batteries.html,"Tesla and Elon continue to develop 4680 batteries, AI4 and AI5 inference chips and Tesla Dojo chips. I have projected that Tesla could get trillions in value from cracking making Dojo chips being bro… [+3154 chars]","Strategic Importance of Tesla Dojo Chips and 4680 Batteries Tesla and Elon continue to develop 4680 batteries, AI4 and AI5 inference chips and Tesla Dojo chips. I have projected that Tesla could get trillions in value from cracking making Dojo chips being broadly useful for xAI for large language model training. 4680 …",0.9897054936736822
Netflix,2025-05-09,The Verge,Netflix is removing Black Mirror: Bandersnatch,"Netflix is removing the last two shows listed on its Interactive Specials page: Black Mirror: Bandersnatch and Unbreakable Kimmy Schmidt: Kimmy vs. the Reverend, reports What’s on Netflix. The two specials will be pulled on May 12th, 2025, according to the pu…",https://www.theverge.com/news/663933/netflix-black-mirror-bandersnatch-kimmy-schmidt-removal,"The company has been moving in a different direction with its interactive experiences.
The company has been moving in a different direction with its interactive experiences.
Netflix is removing the… [+1607 chars]","Netflix is removing Black Mirror: Bandersnatch Netflix is removing the last two shows listed on its Interactive Specials page: Black Mirror: Bandersnatch and Unbreakable Kimmy Schmidt: Kimmy vs. the Reverend, reports What’s on Netflix. The two specials will be pulled on May 12th, 2025, according to the pu…",0.9999641410156528
Netflix,2025-05-09,Polygon,Netflix is reportedly removing Black Mirror: Bandersnatch next week,"Just a few weeks after releasing “Plaything,” a sequel to Black Mirror: Bandersnatch, Netflix will remove the award-winning interactive special from the platform. Bandersnatch and Unbreakable Kimmy Schmidt: Kimmy vs. the Reverend will both be delisted from th…",https://www.polygon.com/news/598247/netflix-removing-black-mirror-bandersnatch,"Just a few weeks after releasing “Plaything,” a sequel to Black Mirror: Bandersnatch, Netflix will remove the award-winning interactive special from the platform. Bandersnatch and Unbreakable Kimmy S… [+1786 chars]","Netflix is reportedly removing Black Mirror: Bandersnatch next week Just a few weeks after releasing “Plaything,” a sequel to Black Mirror: Bandersnatch, Netflix will remove the award-winning interactive special from the platform. Bandersnatch and Unbreakable Kimmy Schmidt: Kimmy vs. the Reverend will both be delisted from th…",0.9940602907536231
Netflix,2025-05-09,IGN,Netflix To Remove Black Mirror: Bandersnatch From Platform In an Effort to Ditch Interactive Programming,"Netflix is giving up the ghost when it comes to its interactive projects — and that includes the hit Black Mirror film that took the world by storm when it debuted on the platform in 2018. The streamer will remove Black Mirror: Bandersnatch from the service, …",https://www.ign.com/articles/netflix-to-remove-black-mirror-bandersnatch-from-platform-in-an-effort-to-ditch-interactive-programming,Netflix is giving up the ghost when it comes to its interactive projects and that includes the hit Black Mirror film that took the world by storm when it debuted on the platform in 2018. The streamer… [+1884 chars],"Netflix To Remove Black Mirror: Bandersnatch From Platform In an Effort to Ditch Interactive Programming Netflix is giving up the ghost when it comes to its interactive projects — and that includes the hit Black Mirror film that took the world by storm when it debuted on the platform in 2018. The streamer will remove Black Mirror: Bandersnatch from the service, …",0.9998681060205854
Netflix,2025-05-09,Forbes,Will There Be A ‘Blood Of Zeus’ Season 4 On Netflix?,"The animated adventure series ""Blood of Zeus"" returned to Netflix this week for Season 3. Is another season on the way?",https://www.forbes.com/sites/timlammers/2025/05/09/will-there-be-a-blood-of-zeus-season-4-on-netflix/,"Hades (voice of Fred Tatasciore) and Hera (voice of Claudia Ann Christian) in ""Blood of Zeus: Season ... More 3.""
NETFLIX
The animated adventure series Blood of Zeus returned to Netflix this week f… [+3592 chars]","Will There Be A ‘Blood Of Zeus’ Season 4 On Netflix? The animated adventure series ""Blood of Zeus"" returned to Netflix this week for Season 3. Is another season on the way?",0.9998721915835631
Netflix,2025-05-09,Forbes,Chef’s Table: Legends On Netflix—Is A Feat of Food Film And TV,"Have you seen it yet? The 10th Anniversary season of Chef's Table not only features legends in the culinary world, but illustrates a force in food film and television.",https://www.forbes.com/sites/kristinwolfe/2025/05/09/chefs-table-legends-on-netflix-is-a-feat-of-food-film-and-tv/,"The 10th Anniversary season of Chef's Table: Legends is streaming now.
Netflix
It is here.
The anticipated 10th Anniversary season of Chefs Table on Netflix kicked off on April 28, and the buzz su… [+10080 chars]","Chef’s Table: Legends On Netflix—Is A Feat of Food Film And TV Have you seen it yet? The 10th Anniversary season of Chef's Table not only features legends in the culinary world, but illustrates a force in food film and television.",0.9999879076381148
Netflix,2025-05-09,Forbes,The Best New Netflix Show Nabs A Perfect 100% Critic Score,"The best new show to hit Netflix in a while has arrived with perfect scores from critics, but it may not be for everyone, given its subject matter.",https://www.forbes.com/sites/paultassi/2025/05/09/the-best-new-netflix-show-nabs-a-perfect-100-critic-score/,"Forever
Netflix
Its a pretty good week for Netflix TV, as the service has not one but two 100% scored shows this week. Ive already written about one, so I figured that I would focus on the other, a… [+2230 chars]","The Best New Netflix Show Nabs A Perfect 100% Critic Score The best new show to hit Netflix in a while has arrived with perfect scores from critics, but it may not be for everyone, given its subject matter.",0.9946819019969553
Netflix,2025-05-09,TechRadar,"7 new movies and TV shows to stream on Netflix, Prime Video, Hulu, and more this weekend (May 9)","From a romantic horror movie to the return of a hit mystery drama series, here's what you'll want to stream this weekend.",https://www.techradar.com/streaming/7-new-movies-and-tv-shows-to-stream-on-netflix-prime-video-hulu-and-more-this-weekend-may-9,"There's a real mix of new movies and shows to explore on the best streaming services this Mother's Day weekend for those in the US and Australia, and Netflix is leading the charge with its slate of n… [+5832 chars]","7 new movies and TV shows to stream on Netflix, Prime Video, Hulu, and more this weekend (May 9) From a romantic horror movie to the return of a hit mystery drama series, here's what you'll want to stream this weekend.",0.999993164892885
Netflix,2025-05-09,Forbes,"What To Watch This Weekend: New Shows And Movies To Stream On Netflix, Hulu, Prime Video, Apple TV And More",Everything new to stream this weekend on all your favorite streaming services from Netflix to Apple TV to Hulu and more.,https://www.forbes.com/sites/erikkain/2025/05/09/what-to-watch-this-weekend-new-shows-and-movies-to-stream-on-netflix-hulu-prime-video-apple-tv-and-more/,"What to watch this weekend.
Credit: Peacock / Netflix / Max
Terrifying serial killers, hilarious travel videos and an incidental investigator who can always tell when someone all make up this weeke… [+9989 chars]","What To Watch This Weekend: New Shows And Movies To Stream On Netflix, Hulu, Prime Video, Apple TV And More Everything new to stream this weekend on all your favorite streaming services from Netflix to Apple TV to Hulu and more.",0.9999265137230395
Netflix,2025-05-09,MobileSyrup,Netflix to get Rob Ford ‘Trainwreck’ documentary in June,"A new documentary centred around the late Toronto mayor Rob Ford will hit Netflix on June 17. The film is called Trainwreck: Mayor of Mayhem and chronicles the scandals of Ford’s wild career, including his hard drug use, and the international media cycle that…",https://mobilesyrup.com/2025/05/09/netflix-trainwreck-documentary-rob-ford-june/,"A new documentary centred around the late Toronto mayor Rob Ford will hit Netflix on June 17.
The film is called Trainwreck: Mayor of Mayhem and chronicles the scandals of Ford’s wild career, includ… [+827 chars]","Netflix to get Rob Ford ‘Trainwreck’ documentary in June A new documentary centred around the late Toronto mayor Rob Ford will hit Netflix on June 17. The film is called Trainwreck: Mayor of Mayhem and chronicles the scandals of Ford’s wild career, including his hard drug use, and the international media cycle that…",0.9999868668761565
AMD,2025-05-09,Nietras.com,21 GB/s CSV Parsing Using SIMD on AMD 9950X,"Sep 0.10.0 was released April 22nd,
2025 with optimizations
for AVX-512 capable CPUs like the AMD
9950X (Zen 5) and updated benchmarks
including the 9950X. Sep now achieves a staggering 21 GB/s on the 9950X for
the low-level CSV parsing.  Before 0.10.0, Sep…",https://nietras.com/2025/05/09/sep-0-10-0/,"Sep 0.10.0 was released April 22nd,
2025 with optimizations
for AVX-512 capable CPUs like the AMD
9950X (Zen 5) and updated benchmarks
including the 9950X. Sep now achieves a staggering 21 GB/s o… [+24419 chars]","21 GB/s CSV Parsing Using SIMD on AMD 9950X Sep 0.10.0 was released April 22nd,
2025 with optimizations
for AVX-512 capable CPUs like the AMD
9950X (Zen 5) and updated benchmarks
including the 9950X. Sep now achieves a staggering 21 GB/s on the 9950X for
the low-level CSV parsing.  Before 0.10.0, Sep…",0.9999930000681161
AMD,2025-05-09,TechRadar,Chinese PC vendor shows rare picture of dozens of AMD Ryzen AI Max+ 395 mini workstations undergoing final aging tests and yes they've all got RGB fans spinning,GMKtec shares rare image of its AMD Ryzen AI Max+ 395 mini PCs in final pre-shipment testing phase.,https://www.techradar.com/pro/chinese-pc-vendor-shows-rare-picture-of-dozens-of-amd-ryzen-ai-max-395-mini-workstations-undergoing-final-aging-tests-and-yes-theyve-all-got-rgb-fans-spinning,<ul><li>GMKtec's EVO-X2 launch reportedly saw hundreds of units sold on day one</li><li>The devices are powered by AMD Ryzen AI Max+ 395 with 50 TOPS AI performance </li><li>Racks of the RGB-lit mini… [+2400 chars],Chinese PC vendor shows rare picture of dozens of AMD Ryzen AI Max+ 395 mini workstations undergoing final aging tests and yes they've all got RGB fans spinning GMKtec shares rare image of its AMD Ryzen AI Max+ 395 mini PCs in final pre-shipment testing phase.,0.9993983979802579
AMD,2025-05-09,Cowcotland.com,Les drivers AMD Adrenalin Edition 25.5.1 WHQL sont disponibles,AMD Known Issues    -    Intermittent application crash or driver timeout may be observed while playing The Last of Us Part 2.  -    Stutter may be observed while playing games with some VR headsets at 80Hz or 90Hz ...,https://www.cowcotland.com/news/96089/les-drivers-amd-adrenalin-edition-25-5-1-whql-sont-disponibles.html,"AMDdrenalin Edition 25.5.1 WHQL, avec une promesse d'optimisation pour les jeux DOOM: The Dark Ages et F1 25. AMD annonce également le support de sa technologie FSR4 dans les jeux Ghost of Tsushima D… [+1433 chars]",Les drivers AMD Adrenalin Edition 25.5.1 WHQL sont disponibles AMD Known Issues    -    Intermittent application crash or driver timeout may be observed while playing The Last of Us Part 2.  -    Stutter may be observed while playing games with some VR headsets at 80Hz or 90Hz ...,0.9997000679204575
AMD,2025-05-09,Biztoc.com,"Advanced Micro Devices, Inc. (AMD) – Upgraded on Multi-Billion Growth Opportunities","We recently published a list of 10 AI Stocks on Wall Street’s Radar Right Now. In this article, we are going to take a look at where Advanced Micro Devices, Inc. (NASDAQ:AMD) stands against other AI stocks on Wall Street’s radar right now.
According to a stat…",https://biztoc.com/x/45c60180f41298a9,"We recently published a list of 10 AI Stocks on Wall Streets Radar Right Now. In this article, we are going to take a look at where Advanced Micro Devices, Inc. (NASDAQ:AMD) stands against other AI s… [+142 chars]","Advanced Micro Devices, Inc. (AMD) – Upgraded on Multi-Billion Growth Opportunities We recently published a list of 10 AI Stocks on Wall Street’s Radar Right Now. In this article, we are going to take a look at where Advanced Micro Devices, Inc. (NASDAQ:AMD) stands against other AI stocks on Wall Street’s radar right now.
According to a stat…",0.999890899649472
AMD,2025-05-09,Biztoc.com,"AMD: Q1 Performance Tests My Bear Thesis, But Risks Persist, Upgrade",,https://biztoc.com/x/890f733fdc183537,"{ window.open(this.href, '_blank'); }, 200); return false;""&gt;What impact did the US-UK trade deal have on tariffs? { window.open(this.href, '_blank'); }, 200); return false;""&gt;Why did Senate Demo… [+1017 chars]","AMD: Q1 Performance Tests My Bear Thesis, But Risks Persist, Upgrade ",-0.9701737144932849
AMD,2025-05-09,Gadgets360.com,New Era of AI PCs Begins: AMD Ryzen™ AI 300 Series Puts Smart Features in Your Hands,"The latest lineup from AMD comes with all the features and specifications that provide state-of-the-art performance and make your PC smarter. The new chipset from the brand is built on three main pillars: a next-gen CPU based on Zen architecture, an integrate…",https://www.gadgets360.com/laptops/sponsored/new-era-of-ai-pcs-begins-amd-ryzen-ai-300-series-puts-smart-features-in-your-hands-8351667,"Gone are the days when artificial intelligence (AI) was only restricted to servers and applications. With the new wave of laptops since 2024, we have seen an unprecedented growth of AI PCs, all thank… [+9231 chars]","New Era of AI PCs Begins: AMD Ryzen™ AI 300 Series Puts Smart Features in Your Hands The latest lineup from AMD comes with all the features and specifications that provide state-of-the-art performance and make your PC smarter. The new chipset from the brand is built on three main pillars: a next-gen CPU based on Zen architecture, an integrate…",0.5912695080041885
AMD,2025-05-09,Dealcatcher.com,"Office Depot - HP 23.8"" All-in-One Desktop PC, AMD Athlon Gold, 4GB RAM, 256GB SSD, Windows 11 Home $459.99","Over $500 million saved... and counting. Save money at your favorite stores including Amazon, Kohls, Target, and thousands more. Updated daily!",https://www.dealcatcher.com/?offer=998446074&utm_source=rss,Miracle-Gro All-Purpose Garden Soil is on sale at Lowes for just $2. That's over 50% off the original price of $4.58! This is an excellent opportunity to stock up on soil for your spring gardening...,"Office Depot - HP 23.8"" All-in-One Desktop PC, AMD Athlon Gold, 4GB RAM, 256GB SSD, Windows 11 Home $459.99 Over $500 million saved... and counting. Save money at your favorite stores including Amazon, Kohls, Target, and thousands more. Updated daily!",0.9998936760239303
