ticker,date,source,title,description,url,content,text,sentiment
Apple,2025-05-11,The Verge,"Apple may release a ‘mostly glass, curved iPhone’ in 2027","This morning, while summarizing an Apple “product blitz” he expects for 2027, Bloomberg’s Mark Gurman writes in his Power On newsletter that Apple is planning a “mostly glass, curved iPhone” with no display cutouts for that year, which happens to be the iPhon…",https://www.theverge.com/news/664776/apple-curved-glass-iphone-2027,"The iPhone 16 Pro Max, pictured here, is already pretty glassy.


This morning, while summarizing an Apple “product blitz” he expects for 2027, Bloomberg’s Mark Gurman writes in his Power On newslet… [+2249 chars]","Apple may release a ‘mostly glass, curved iPhone’ in 2027 This morning, while summarizing an Apple “product blitz” he expects for 2027, Bloomberg’s Mark Gurman writes in his Power On newsletter that Apple is planning a “mostly glass, curved iPhone” with no display cutouts for that year, which happens to be the iPhon…",0.9999649005767424
Apple,2025-05-11,9to5Mac,M4 MacBook Pro might be one of the first worthy upgrades for Apple Silicon Mac users,"Last October, Apple announced the . On the surface, it looks like yet another MacBook Pro spec bump. However, there are a number of key features that make it worth upgrading to, even if you already have an older .



 more…",https://9to5mac.com/2025/05/10/apple-m4-macbook-pro-worthwhile-upgrade-reasons-why/,"Last October, Apple announced the M4 MacBook Pro. On the surface, it looks like yet another MacBook Pro spec bump. However, there are a number of key features that make it worth upgrading to, even if… [+5097 chars]","M4 MacBook Pro might be one of the first worthy upgrades for Apple Silicon Mac users Last October, Apple announced the . On the surface, it looks like yet another MacBook Pro spec bump. However, there are a number of key features that make it worth upgrading to, even if you already have an older .



 more…",0.9476889744400978
Apple,2025-05-11,9to5Mac,"Apple reportedly has a ‘product renaissance’ planned for 2027, here’s what’s coming","Apple has a number of exciting products in the pipeline for 2027, per Bloomberg’s Mark Gurman. Despite recent Apple releases feeling somewhat stagnant, Apple has a plan to freshen things up. Gurman describes this product road map as a “product renaissance,” a…",https://9to5mac.com/2025/05/11/apple-product-renaissance-2027-roadmap/,"Apple has a number of exciting products in the pipeline for 2027, per Bloomberg’s Mark Gurman. Despite recent Apple releases feeling somewhat stagnant, Apple has a plan to freshen things up. Gurman d… [+2993 chars]","Apple reportedly has a ‘product renaissance’ planned for 2027, here’s what’s coming Apple has a number of exciting products in the pipeline for 2027, per Bloomberg’s Mark Gurman. Despite recent Apple releases feeling somewhat stagnant, Apple has a plan to freshen things up. Gurman describes this product road map as a “product renaissance,” a…",0.9960722419200465
Apple,2025-05-11,9to5Mac,"Fortnite includes Apple IAP and Epic checkout, fate rests with App Store review",Epic Games submitted Fortnite to the App Store for review on Friday. Now what? The version under review offers both Apple’s in-app purchase system and an external payment option via the Epic Games Store. But despite recent policy changes forced by a federal i…,https://9to5mac.com/2025/05/11/fortnite-app-store-review/,Epic Games submitted Fortnite to the App Store for review on Friday. Now what? The version under review offers both Apples in-app purchase system and an external payment option via the Epic Games Sto… [+3068 chars],"Fortnite includes Apple IAP and Epic checkout, fate rests with App Store review Epic Games submitted Fortnite to the App Store for review on Friday. Now what? The version under review offers both Apple’s in-app purchase system and an external payment option via the Epic Games Store. But despite recent policy changes forced by a federal i…",0.9998851896143606
Apple,2025-05-11,AppleInsider,Apple wants to simplify adding multiple devices to captive Wi-Fi,"A new report claims that Apple is working on how to have its devices share Wi-Fi login details on commercial or captive networks.An example of logging in to a captive Wi-Fi hotspot on iPhoneSince iOS 11 and macOS High Sierra in 2017, Apple has made it so that…",https://appleinsider.com/articles/25/05/11/apple-wants-to-simplify-adding-multiple-devices-to-captive-wi-fi,"A new report claims that Apple is working on how to have its devices share Wi-Fi login details on commercial or captive networks.
Since iOS 11 and macOS High Sierra in 2017, Apple has made it so tha… [+1603 chars]","Apple wants to simplify adding multiple devices to captive Wi-Fi A new report claims that Apple is working on how to have its devices share Wi-Fi login details on commercial or captive networks.An example of logging in to a captive Wi-Fi hotspot on iPhoneSince iOS 11 and macOS High Sierra in 2017, Apple has made it so that…",0.9920281027443707
Apple,2025-05-11,Slickdeals.net,"Apple MacBook Air (2025, Sky Blue): 13.6"", M4, 256GB SSD, 16GB RAM $837.20 + Free Shipping","Amazon.com: Apple 2025 MacBook Air 13-inch Laptop with M4 chip: Built for Apple Intelligence, 13.6-inch Liquid Retina Display, 16GB Unified Memory, 256GB SSD Storage, 12MP Center Stage Camera, Touch...",https://slickdeals.net/f/18307627-apple-macbook-air-13-m4-16gb-ram-256gb-ssd-sky-blue-837-19?utm_source=rss&utm_content=fp&utm_medium=RSS2,"This collaborative space allows users to contribute additional information, tips, and insights to enhance the original deal post. Feel free to share your knowledge and help fellow shoppers make infor… [+26 chars]","Apple MacBook Air (2025, Sky Blue): 13.6"", M4, 256GB SSD, 16GB RAM $837.20 + Free Shipping Amazon.com: Apple 2025 MacBook Air 13-inch Laptop with M4 chip: Built for Apple Intelligence, 13.6-inch Liquid Retina Display, 16GB Unified Memory, 256GB SSD Storage, 12MP Center Stage Camera, Touch...",0.9988022585748695
Apple,2025-05-11,Creative Bloq,5 perfect Apple font choices (and one disaster),Apple fonts haven't always been brilliant in every way.,https://www.creativebloq.com/design/fonts-typography/5-perfect-apple-font-choices-and-one-disaster,"Apple is known for sleek, minimalist design, from its products to its branding. We've already recapped the Apple logo history, but what about Apple typography? What font does Apple use to back up its… [+6401 chars]",5 perfect Apple font choices (and one disaster) Apple fonts haven't always been brilliant in every way.,0.9999632058097632
Apple,2025-05-11,Idownloadblog.com,Apple “product renaissance” could take place around two years from now,"Apple reportedly has some pretty exciting gadgets in store for 2027, with the company's roadmap being described as a “product renaissance.”",https://www.idownloadblog.com/2025/05/11/apple-product-renaissance-rumor/,"Apple reportedly has some pretty exciting gadgets in store for 2027, with the company’s roadmap being described as a product renaissance.
Years of iterative updates have taken a toll on sales. Image… [+3053 chars]","Apple “product renaissance” could take place around two years from now Apple reportedly has some pretty exciting gadgets in store for 2027, with the company's roadmap being described as a “product renaissance.”",-0.06706896424293518
Apple,2025-05-11,iLounge,New games arriving on Apple Arcade in June,"Apple recently announced the arrival of new games on Apple Arcade. Five new games will be making an appearance in the Apple Arcade service, including UNO: Arcade Edition, WHAT THE CAR?, Helix Jump+, Lost in Play, and LEGO Hill Climb Adventures+. It’s worth no…",https://www.ilounge.com/news/apple/new-games-arriving-on-apple-arcade-in-june,"Apple recently announced the arrival of new games on Apple Arcade.
Five new games will be making an appearance in the Apple Arcade service, including UNO: Arcade Edition, WHAT THE CAR?, Helix Jump+,… [+700 chars]","New games arriving on Apple Arcade in June Apple recently announced the arrival of new games on Apple Arcade. Five new games will be making an appearance in the Apple Arcade service, including UNO: Arcade Edition, WHAT THE CAR?, Helix Jump+, Lost in Play, and LEGO Hill Climb Adventures+. It’s worth no…",0.9994380429852754
Apple,2025-05-11,Forbes,Apple iOS 18.5 Critical iPhone Update Lands Any Minute Now: What To Expect,The next iPhone update is one of the last major releases in the iOS 18 cycle. Here’s when it’s coming and what’ll be in it.,https://www.forbes.com/sites/davidphelan/2025/05/11/apple-ios-185-critical-iphone-update-lands-any-minute-now-what-to-expect/,"Apple never says exactly when its iPhone updates will land, but in the case of the next one, iOS 18.5, its dropped enough clues for us to know that its very nearly here. Heres what we know.
Apple is… [+2118 chars]",Apple iOS 18.5 Critical iPhone Update Lands Any Minute Now: What To Expect The next iPhone update is one of the last major releases in the iOS 18 cycle. Here’s when it’s coming and what’ll be in it.,0.9999754909740659
Apple,2025-05-10,Hackaday,The Apple II MouseCard IRQ is Synced to Vertical Blanking After All,Recently [Colin Leroy-Mira] found himself slipping into a bit of a rabbit hole while investigating why only under Apple II MAME emulation there was a lot of flickering when using the (emulated) App…,https://hackaday.com/2025/05/09/the-apple-ii-mousecard-irq-is-synced-to-vertical-blanking-after-all/,Recently [Colin Leroy-Mira] found himself slipping into a bit of a rabbit hole while investigating why only under Apple II MAME emulation there was a lot of flickering when using the (emulated) Apple… [+1037 chars],The Apple II MouseCard IRQ is Synced to Vertical Blanking After All Recently [Colin Leroy-Mira] found himself slipping into a bit of a rabbit hole while investigating why only under Apple II MAME emulation there was a lot of flickering when using the (emulated) App…,0.9998606724183787
Apple,2025-05-10,9to5Mac,Apple @ Work: The end of Windows 10 could give Apple a major boost in the enterprise,"Apple @ Work is exclusively brought to you by Mosyle, the only Apple Unified Platform. Mosyle is the only solution that integrates in a single professional-grade platform all the solutions necessary to seamlessly and automatically deploy, manage & protect App…",https://9to5mac.com/2025/05/10/the-end-of-windows-10-could-give-apple-a-major-boost-in-the-enterprise/,"Apple @ Work is exclusively brought to you by Mosyle, the only Apple Unified Platform. Mosyle is the only solution that integrates in a single professional-grade platform all the solutions necessary … [+4130 chars]","Apple @ Work: The end of Windows 10 could give Apple a major boost in the enterprise Apple @ Work is exclusively brought to you by Mosyle, the only Apple Unified Platform. Mosyle is the only solution that integrates in a single professional-grade platform all the solutions necessary to seamlessly and automatically deploy, manage & protect App…",-0.9999990100252489
Apple,2025-05-10,9to5Mac,Newly-elected Pope wears Apple Watch on first official mess,"If you think tech nerds are excessively obsessive about their hobbies, you don’t know watch nerds. The horology corners of the internet host deep, sprawling discussions that make even the longest John Siracusa explainer or episode of The Talk Show seem superf…",https://9to5mac.com/2025/05/10/pope-wears-apple-watch-in-first-mess/,"If you think tech nerds are excessively obsessive about their hobbies, you dont know watch nerds. The horology corners of the internet host deep, sprawling discussions that make even the longest John… [+1409 chars]","Newly-elected Pope wears Apple Watch on first official mess If you think tech nerds are excessively obsessive about their hobbies, you don’t know watch nerds. The horology corners of the internet host deep, sprawling discussions that make even the longest John Siracusa explainer or episode of The Talk Show seem superf…",0.9953809361686581
Apple,2025-05-10,9to5Mac,"Review: Anker’s compact 25,000mAh battery bank is top-notch for powering Apple devices","At CES 2025, Anker unveiled a . It’s extremely compact, offers up to 25,000mAh of capacity, and has multiple built in cables for ease of use.



I’ve utilized this battery bank for many months, and I can confidently say its an easy purchase if you’re looking …",https://9to5mac.com/2025/05/10/anker-25k-compact-battery-power-bank-review-for-apple-devices/,"At CES 2025, Anker unveiled a rather interesting new battery bank. It’s extremely compact, offers up to 25,000mAh of capacity, and has multiple built in cables for ease of use.
I’ve utilized this ba… [+2122 chars]","Review: Anker’s compact 25,000mAh battery bank is top-notch for powering Apple devices At CES 2025, Anker unveiled a . It’s extremely compact, offers up to 25,000mAh of capacity, and has multiple built in cables for ease of use.



I’ve utilized this battery bank for many months, and I can confidently say its an easy purchase if you’re looking …",-0.9632603134959936
Apple,2025-05-10,Slickdeals.net,"128GB Apple iPad 11"" A16 Chip WiFi Tablet (Pink, Early 2025) $267.15 + Free Shipping","Great discount on the new iPad! Available at Amazon and Walmart, Pink color. 
 
https://www.amazon.com/dp/B0DZ7871B8 
https://www.walmart.com/ip/seort/15474310590 
 
*$267 + Free Shipping* >$267.17",https://slickdeals.net/f/18305362-128gb-apple-ipad-11-a16-chip-wifi-tablet-pink-early-2025-267-15-free-shipping?utm_source=rss&utm_content=fp&utm_medium=RSS2,"This collaborative space allows users to contribute additional information, tips, and insights to enhance the original deal post. Feel free to share your knowledge and help fellow shoppers make infor… [+26 chars]","128GB Apple iPad 11"" A16 Chip WiFi Tablet (Pink, Early 2025) $267.15 + Free Shipping Great discount on the new iPad! Available at Amazon and Walmart, Pink color. 
 
https://www.amazon.com/dp/B0DZ7871B8 
https://www.walmart.com/ip/seort/15474310590 
 
*$267 + Free Shipping* >$267.17",0.999663901689928
Apple,2025-05-10,Slickdeals.net,Costco Members: Apple Magic Keyboard w/ Touch ID & Numeric Keypad (Lightning) $160 + Free Shipping,"Costco has the Apple Magic Keyboard with Touch ID for 159. 
Good price for this as it's usually 199. 
 
https://www.costco.com/apple-magi...48039.html $159.99",https://slickdeals.net/f/18306610-apple-magic-keyboard-with-touch-id-159-at-costco?utm_source=rss&utm_content=fp&utm_medium=RSS2,"This collaborative space allows users to contribute additional information, tips, and insights to enhance the original deal post. Feel free to share your knowledge and help fellow shoppers make infor… [+26 chars]","Costco Members: Apple Magic Keyboard w/ Touch ID & Numeric Keypad (Lightning) $160 + Free Shipping Costco has the Apple Magic Keyboard with Touch ID for 159. 
Good price for this as it's usually 199. 
 
https://www.costco.com/apple-magi...48039.html $159.99",0.9371072575449944
Apple,2025-05-10,iLounge,Apple sends out Uber one free trial to Apple Card customers,"Apple sent out emails to Apple Card users about their six-month free promo of the Uber One service. Uber One is a consolidated service that offers discounts for rides, pickups and deliveries, and Uber Eats orders. Subscribers get zero delivery fees when they …",https://www.ilounge.com/news/apple/apple-sends-out-uber-one-free-trial-to-apple-card-customers,"Apple sent out emails to Apple Card users about their six-month free promo of the Uber One service.
Uber One is a consolidated service that offers discounts for rides, pickups and deliveries, and Ub… [+707 chars]","Apple sends out Uber one free trial to Apple Card customers Apple sent out emails to Apple Card users about their six-month free promo of the Uber One service. Uber One is a consolidated service that offers discounts for rides, pickups and deliveries, and Uber Eats orders. Subscribers get zero delivery fees when they …",0.9996422822005115
Apple,2025-05-10,Slickdeals.net,"Refurbished 16"" Apple MacBook Pro Laptop: M1 Max Chip, 64GB RAM, 1TB SSD (2021) $1392 + Free Shipping","Sold by Tek Deals Store via eBay. 

&quot;1-year warranty: This item has a 1-year warranty serviced by Allstate&quot;

https://www.ebay.com/itm/14650314...5000006407",https://slickdeals.net/f/18305626-apple-macbook-pro-refurb-16-m1-max-64gb-ram-1tb-ssd-silver-1391-99?utm_source=rss&utm_content=fp&utm_medium=RSS2,"This collaborative space allows users to contribute additional information, tips, and insights to enhance the original deal post. Feel free to share your knowledge and help fellow shoppers make infor… [+26 chars]","Refurbished 16"" Apple MacBook Pro Laptop: M1 Max Chip, 64GB RAM, 1TB SSD (2021) $1392 + Free Shipping Sold by Tek Deals Store via eBay. 

&quot;1-year warranty: This item has a 1-year warranty serviced by Allstate&quot;

https://www.ebay.com/itm/14650314...5000006407",0.9998850055599178
Apple,2025-05-10,Forbes,Apple iPhone 16 Price Slashed In Major New Sale,Apple's iPhone 16 gets a new low price ahead of Samsung's Galaxy S25 Edge release.,https://www.forbes.com/sites/jaymcgregor/2025/05/10/new-apple-iphone-16-price-cut-deal-amazon-sale/,"Apple's iPhone 16 has received a new price cut. (Photo by Michael M. Santiago/Getty Images)
Getty Images
Mothers Day sales are in full swing. Google got in early with its extensive Pixel 9 discount… [+2313 chars]",Apple iPhone 16 Price Slashed In Major New Sale Apple's iPhone 16 gets a new low price ahead of Samsung's Galaxy S25 Edge release.,0.9423093162477016
Apple,2025-05-10,Creative Bloq,Inside the sketchbook of Netflix and Apple background artist Sergio Mancinelli,From dreamy pencil lines to colourful urban sketches this sketchbook captures the soul behind the your favourite animations.,https://www.creativebloq.com/art/inside-the-sketchbook-of-netflix-and-apple-background-artist-sergio-mancinelli,Sergio Mancinelli is a character designer and visual developer based in Italy. He worked on the Netflix feature film Klaus for Spa Studios in Madrid and as a layout artist for the Oscar-winning short… [+6327 chars],Inside the sketchbook of Netflix and Apple background artist Sergio Mancinelli From dreamy pencil lines to colourful urban sketches this sketchbook captures the soul behind the your favourite animations.,0.9999464573575096
Apple,2025-05-09,Gizmodo.com,Apple AirPods Alternative? Beats Studio Buds+ Are Now Going for Peanuts on Amazon,"Need a new pair of earbuds? You can't go wrong with this pick from Beats, especially at this discounted price.",https://gizmodo.com/apple-airpods-alternative-beats-studio-buds-are-now-going-for-peanuts-on-amazon-2000599952,"A great pair of earbuds can be hard to come by if you’re on a budget. While there are tons to choose from, they’re not all going to reflect the same quality as some of the bigger name brands out ther… [+1988 chars]","Apple AirPods Alternative? Beats Studio Buds+ Are Now Going for Peanuts on Amazon Need a new pair of earbuds? You can't go wrong with this pick from Beats, especially at this discounted price.",0.9990204011119204
Apple,2025-05-09,MacRumors,Set Up a Recovery Contact for Your Apple Account,"Losing your Apple Account password can make your digital life a misery, as it can leave you locked out of the account that you use to manage your Apple devices, unable to access your iCloud data and manage your app and service subscriptions. 





In this sce…",https://www.macrumors.com/how-to/set-up-recovery-contact-apple-account/,"Losing your Apple Account password can make your digital life a misery, as it can leave you locked out of the account that you use to manage your Apple devices, unable to access your iCloud data and … [+3995 chars]","Set Up a Recovery Contact for Your Apple Account Losing your Apple Account password can make your digital life a misery, as it can leave you locked out of the account that you use to manage your Apple devices, unable to access your iCloud data and manage your app and service subscriptions. 





In this sce…",0.0005376792760216631
Apple,2025-05-09,MacRumors,Apple Acquisition Hints at Upgraded Calendar App on iOS 19 or Beyond,"Apple acquired Canadian startup Mayday Labs in April 2024, according to a European Commission listing, spotted by French blog MacGeneration. The acquisition had not received widespread attention from tech publications until now.





Apple is legally required…",https://www.macrumors.com/2025/05/09/apple-acquired-mayday-labs/,"Apple acquired Canadian startup Mayday Labs in April 2024, according to a European Commission listing, spotted by French blog MacGeneration. The acquisition had not received widespread attention from… [+2031 chars]","Apple Acquisition Hints at Upgraded Calendar App on iOS 19 or Beyond Apple acquired Canadian startup Mayday Labs in April 2024, according to a European Commission listing, spotted by French blog MacGeneration. The acquisition had not received widespread attention from tech publications until now.





Apple is legally required…",0.999983964517412
Apple,2025-05-09,MacRumors,"Former Apple Design Chief Jony Ive Reflects on Company Culture, Iconic Products, and a Warning for the Tech Industry","Apple's former Chief Design Officer Jony Ive has given a rare and wide-ranging interview at Stripe Sessions 2025, offering new insights into his design philosophy, his time at Apple, and his current work at his design collective, LoveFrom.








In a one-h…",https://www.macrumors.com/2025/05/09/jony-ive-reflects-on-culture-products-and-warning/,"Apple's former Chief Design Officer Jony Ive has given a rare and wide-ranging interview at Stripe Sessions 2025, offering new insights into his design philosophy, his time at Apple, and his current … [+4154 chars]","Former Apple Design Chief Jony Ive Reflects on Company Culture, Iconic Products, and a Warning for the Tech Industry Apple's former Chief Design Officer Jony Ive has given a rare and wide-ranging interview at Stripe Sessions 2025, offering new insights into his design philosophy, his time at Apple, and his current work at his design collective, LoveFrom.








In a one-h…",0.9999388245360024
Apple,2025-05-09,AppleInsider,"Apple acquisitions hint at Apple Intelligence coming to Calendar, and the factory floor","Apple has been quietly buying AI firms whose work suggests the company is looking to bring Apple Intelligence to chatbots, individual users' calendars, and perhaps to its own manufacturing.Screenshot from Mayday, the scheduling calendar app that Apple bought …",https://appleinsider.com/articles/25/05/09/apple-acquisitions-hint-at-apple-intelligence-coming-to-calendar-and-the-factory-floor,"Apple has been quietly buying AI firms whose work suggests the company is looking to bring Apple Intelligence to chatbots, individual users' calendars, and perhaps to its own manufacturing.
News of … [+4376 chars]","Apple acquisitions hint at Apple Intelligence coming to Calendar, and the factory floor Apple has been quietly buying AI firms whose work suggests the company is looking to bring Apple Intelligence to chatbots, individual users' calendars, and perhaps to its own manufacturing.Screenshot from Mayday, the scheduling calendar app that Apple bought …",0.999943950881061
Apple,2025-05-09,9to5Mac,Apple Pay support now available on PlayStation 5,"PlayStation 5 users now have an additional way to complete purchases of games and other content on their consoles: Apple Pay. Here’s how it works. 



 more…",https://9to5mac.com/2025/05/09/ps5-apple-pay/,"PlayStation 5 users now have an additional way to complete purchases of games and other content on their consoles: Apple Pay. Here’s how it works. 
When going through the checkout process on your PS… [+1080 chars]","Apple Pay support now available on PlayStation 5 PlayStation 5 users now have an additional way to complete purchases of games and other content on their consoles: Apple Pay. Here’s how it works. 



 more…",0.9997655733604915
Apple,2025-05-09,9to5Mac,Apple TV+ has three big new releases coming very soon,"Apple TV+ has hit its stride this year, finding big success with Severance, The Studio, and Your Friends & Neighbors. But there’s more right around the corner. Here are three big new Apple TV+ releases coming soon.



 more…",https://9to5mac.com/2025/05/09/apple-tv-has-three-big-new-releases-coming-very-soon/,"Apple TV+ has hit its stride this year, finding big success with Severance, The Studio, and Your Friends &amp; Neighbors. But theres more right around the corner. Here are three big new Apple TV+ rel… [+3604 chars]","Apple TV+ has three big new releases coming very soon Apple TV+ has hit its stride this year, finding big success with Severance, The Studio, and Your Friends & Neighbors. But there’s more right around the corner. Here are three big new Apple TV+ releases coming soon.



 more…",-0.9384724758565426
