ticker,date,source,title,description,url,content,text,sentiment
Nvidia,2025-05-11,ETF Daily News,"Inlight Wealth Management LLC Invests $347,000 in NVIDIA Co. (NASDAQ:NVDA)","Inlight Wealth Management LLC purchased a new stake in NVIDIA Co. (NASDAQ:NVDA – Free Report) in the fourth quarter, Holdings Channel.com reports. The firm purchased 2,583 shares of the computer hardware maker’s stock, valued at approximately $347,000. A numb…",https://www.etfdailynews.com/2025/05/11/inlight-wealth-management-llc-invests-347000-in-nvidia-co-nasdaqnvda/,"Inlight Wealth Management LLC purchased a new stake in NVIDIA Co. (NASDAQ:NVDA – Free Report) in the fourth quarter, Holdings Channel.com reports. The firm purchased 2,583 shares of the computer hard… [+5603 chars]","Inlight Wealth Management LLC Invests $347,000 in NVIDIA Co. (NASDAQ:NVDA) Inlight Wealth Management LLC purchased a new stake in NVIDIA Co. (NASDAQ:NVDA – Free Report) in the fourth quarter, Holdings Channel.com reports. The firm purchased 2,583 shares of the computer hardware maker’s stock, valued at approximately $347,000. A numb…",0.9998337558718049
Tesla,2025-05-11,Forbes,Stunt To Crush A Tesla Model 3 Impresses In The Wrong Way,An Anti-Elon stunt has turned into a testament to Tesla toughness. A lot of the anti-Elon is over the top and often has the opposite of the intended effect.,https://www.forbes.com/sites/brookecrothers/2025/05/11/stunt-to-crush-a-tesla-model-3-impresses-in-the-wrong-way/,"TOPSHOT - An artwork by artist Chavis Marmol, a Tesla 3 car crushed by a nine-ton Olmec-inspired ... More head, is pictured in Mexico City on March 13, 2024. A 42-year-old sculptor, Marmol has never … [+1916 chars]",Stunt To Crush A Tesla Model 3 Impresses In The Wrong Way An Anti-Elon stunt has turned into a testament to Tesla toughness. A lot of the anti-Elon is over the top and often has the opposite of the intended effect.,4.061975414515473e-05
Tesla,2025-05-11,Yahoo Entertainment,"Tesla, Inc. (TSLA): Among the High Growth EV Stocks to Invest In","We recently compiled a list of the 10 High Growth EV Stocks to Invest In. In this article, we are going to take a look at where Tesla, Inc. (NASDAQ:TSLA...",https://finance.yahoo.com/news/tesla-inc-tsla-among-high-202520415.html,"We recently compiled a list of the 10 High Growth EV Stocks to Invest In. In this article, we are going to take a look at where Tesla, Inc. (NASDAQ:TSLA) stands against the other best High Growth EV … [+6480 chars]","Tesla, Inc. (TSLA): Among the High Growth EV Stocks to Invest In We recently compiled a list of the 10 High Growth EV Stocks to Invest In. In this article, we are going to take a look at where Tesla, Inc. (NASDAQ:TSLA...",0.9999970410384549
Tesla,2025-05-11,BMWBLOG,You Can Now Buy a V12 BMW M760i for Less Than a Tesla Model Y,"If you’ve been following the car market lately, you’ll know that the Tesla Model Y has become a familiar sight just about everywhere. It’s not only Tesla’s best-selling car, but also one of the most...
First published by https://www.bmwblog.com",https://www.bmwblog.com/2025/05/11/bmw-m760i-v12-cheaper-than-tesla-model-y/,"If youve been following the car market lately, youll know that the Tesla Model Y has become a familiar sight just about everywhere. Its not only Teslas best-selling car, but also one of the most popu… [+4516 chars]","You Can Now Buy a V12 BMW M760i for Less Than a Tesla Model Y If you’ve been following the car market lately, you’ll know that the Tesla Model Y has become a familiar sight just about everywhere. It’s not only Tesla’s best-selling car, but also one of the most...
First published by https://www.bmwblog.com",0.9582972470670938
Tesla,2025-05-11,Biztoc.com,"Welcome back to Tesla, Elon Musk. We’ve missed you","Gus Carlson is a U.S.-based columnist for The Globe and Mail.
Elon Musk’s decision to cut back on his commitment to U.S. President Donald Trump last month and pay more attention to Tesla TSLA-Q could not have come at a better time for the troubled market lead…",https://biztoc.com/x/bedb107d0badde8c,Gus Carlson is a U.S.-based columnist for The Globe and Mail.Elon Musks decision to cut back on his commitment to U.S. President Donald Trump last month and pay more attention to Tesla TSLA-Q could n… [+147 chars],"Welcome back to Tesla, Elon Musk. We’ve missed you Gus Carlson is a U.S.-based columnist for The Globe and Mail.
Elon Musk’s decision to cut back on his commitment to U.S. President Donald Trump last month and pay more attention to Tesla TSLA-Q could not have come at a better time for the troubled market lead…",0.3919910089462064
Tesla,2025-05-11,Biztoc.com,"Tesla employees ask Elon Musk to resign, confirm massive demand problem, get fired for it","Some Tesla employees officially asked for Elon Musk to resign as they confirmed the automaker is facing a massive demand problem, which they attribute to the CEO.
One employee got fired for it.
Regardless of the political spectrum, there’s no doubt that many …",https://biztoc.com/x/9639f59107d27538,"Some Tesla employees officially asked for Elon Musk to resign as they confirmed the automaker is facing a massive demand problem, which they attribute to the CEO.One employee got fired for it.Regardl… [+150 chars]","Tesla employees ask Elon Musk to resign, confirm massive demand problem, get fired for it Some Tesla employees officially asked for Elon Musk to resign as they confirmed the automaker is facing a massive demand problem, which they attribute to the CEO.
One employee got fired for it.
Regardless of the political spectrum, there’s no doubt that many …",0.24430712118191877
Tesla,2025-05-11,Biztoc.com,"With 7 Short Words, Elon Musk and Tesla Just Taught a Key Leadership Lesson (Whether They Meant to or Not)",Don’t sell a product. Sell a vision of the future—even if that vision never actually comes true.,https://biztoc.com/x/dc95b8f007855f41,"Dont sell a product. Sell a vision of the futureeven if that vision never actually comes true.
This story appeared on inc.com, 2025-05-11 07:30:00.","With 7 Short Words, Elon Musk and Tesla Just Taught a Key Leadership Lesson (Whether They Meant to or Not) Don’t sell a product. Sell a vision of the future—even if that vision never actually comes true.",0.07390448451042175
Tesla,2025-05-11,Biztoc.com,"Consumer Tech News (May 5-May 9): Google Faces Divestiture Demand From US DoJ, Microsoft Pulls Plug On Skype, Tesla Axes Cybertruck Range Extender & More",President Donald Trump said he would consider pushing back the June 19 deadline for ByteDance to sell TikTok‘s U.S. operations if a deal is not finalized in time. This marks the third time he’s granted a reprieve to the short video app used by over 170 millio…,https://biztoc.com/x/a96e9b66bb602c6a,President Donald Trump said he would consider pushing back the June 19 deadline for ByteDance to sell TikToks U.S. operations if a deal is not finalized in time. This marks the third time hes granted… [+144 chars],"Consumer Tech News (May 5-May 9): Google Faces Divestiture Demand From US DoJ, Microsoft Pulls Plug On Skype, Tesla Axes Cybertruck Range Extender & More President Donald Trump said he would consider pushing back the June 19 deadline for ByteDance to sell TikTok‘s U.S. operations if a deal is not finalized in time. This marks the third time he’s granted a reprieve to the short video app used by over 170 millio…",0.08736121367837768
Tesla,2025-05-11,The Denver Post,Tesla owners are not your enemies — don’t punish them for Elon Musk’s actions (Letters),"""They don't know Elon Musk and are not responsible for whatever problem you have with him or DOGE. Your concerns may be valid, but the innocent person who drives a Tesla is not your enemy!"" -- 
Cathy Wanstrath, Denver",https://www.denverpost.com/2025/05/11/tesla-vandalism-colorado-tabor-letters/,"Tesla owners are not your enemies
This message is for those people who have vandalized people’s Tesla vehicles. Maybe you found the car in a parking lot, or after dark in front of someone’s home. He… [+6666 chars]","Tesla owners are not your enemies — don’t punish them for Elon Musk’s actions (Letters) ""They don't know Elon Musk and are not responsible for whatever problem you have with him or DOGE. Your concerns may be valid, but the innocent person who drives a Tesla is not your enemy!"" -- 
Cathy Wanstrath, Denver",0.9997430603707471
Tesla,2025-05-11,Fox News,"Tesla road-rage driver allegedly assaults teen, mom in Hawaii months after prison release","Nathaniel Radimak served less than a year of a five-year prison sentence. Now, he's been arrested for allegedly committing a similar crime in Hawaii.",https://www.foxnews.com/us/tesla-road-rage-driver-allegedly-assaults-teen-mom-hawaii-months-prison-release,"A Tesla driver convicted of committing road rage crimes against motorists in Southern California has been arrested again for a similar alleged attack in Hawaii.
Nathaniel Radimak, 39, was charged af… [+1958 chars]","Tesla road-rage driver allegedly assaults teen, mom in Hawaii months after prison release Nathaniel Radimak served less than a year of a five-year prison sentence. Now, he's been arrested for allegedly committing a similar crime in Hawaii.",0.75581193738617
Netflix,2025-05-11,Forbes,The Best Oscar-Winning Movies On Netflix,"Despite its reputation, Netflix has quietly housed Oscar-winning movies for years. Here's a breakdown of every Academy Award winner available on the streamer.",https://www.forbes.com/sites/travisbean/2025/05/11/the-best-oscar-winning-movies-on-netflix/,"A scene from the 2018 film 'Roma.'
Netflix
Lets face it: in cinephile circles, Netflix doesnt have the best reputation when it comes to its movie selection. While the streamer certainly houses lots… [+9414 chars]","The Best Oscar-Winning Movies On Netflix Despite its reputation, Netflix has quietly housed Oscar-winning movies for years. Here's a breakdown of every Academy Award winner available on the streamer.",-0.9550954680889845
Netflix,2025-05-11,Forbes,Will There A ‘Forever’ Season 2 On Netflix? Here’s Why There’s Hope For Keisha And Justin,"The emotional ending of Netflix’s ""Forever"" has fans wondering if there will be a Season 2. Here’s why there’s still a chance the limited series could continue Keisha and Justin’s story.",https://www.forbes.com/sites/monicamercuri/2025/05/11/will-there-a-forever-season-2-on-netflix-heres-why-theres-hope-for-keisha-and-justin/,"FOREVER. (L to R) Lovie Simone as Keisha Clark and Michael Cooper Jr. as Justin Edwards in Episode ... More 102 of Forever. Cr. Elizabeth Morris/Netflix © 2024
Elizabeth Morris/Netflix 
The ending … [+4970 chars]","Will There A ‘Forever’ Season 2 On Netflix? Here’s Why There’s Hope For Keisha And Justin The emotional ending of Netflix’s ""Forever"" has fans wondering if there will be a Season 2. Here’s why there’s still a chance the limited series could continue Keisha and Justin’s story.",0.9980826496903319
Netflix,2025-05-11,Deadline,"‘Forever’ Stars Michael Cooper Jr., Lovie Simone Discuss Filming “Vulnerable” Intimate Scenes For Netflix Series: “We Both Shared A Bit Of Nerves”","In Netflix’s Forever, Mara Brock Akil’s serialized adaptation of Judy Blume’s novel of the same name, two Los Angeles high schoolers navigate young love and their first forays with intimacy. The tender-hearted show, which updates the source material’s time pe…",http://deadline.com/2025/05/forever-netflix-michael-cooper-jr-lovie-simone-1236393066/,"In Netflix‘s Forever, Mara Brock Akil’s serialized adaptation of Judy Blume’s novel of the same name, two Los Angeles high schoolers navigate young love and their first forays with intimacy. The tend… [+2612 chars]","‘Forever’ Stars Michael Cooper Jr., Lovie Simone Discuss Filming “Vulnerable” Intimate Scenes For Netflix Series: “We Both Shared A Bit Of Nerves” In Netflix’s Forever, Mara Brock Akil’s serialized adaptation of Judy Blume’s novel of the same name, two Los Angeles high schoolers navigate young love and their first forays with intimacy. The tender-hearted show, which updates the source material’s time pe…",0.9999669515127607
Netflix,2025-05-11,Anime News Network,Webtoon-Based Action Noir Live-Action Show Mercy for None to Premiere on Netflix June 6,"Streaming company also unveils teaser poster, English-subtitled trailer",https://www.animenewsnetwork.com/news/2025-05-11/webtoon-based-action-noir-live-action-show-mercy-for-none-to-premiere-on-netflix-june-6/.224334,"Image via Netflix Korea's X/Twitter
Netflix Korea confirmed on Friday that the action noir show Mercy for None will premiere on June 6. Ji-sub So stars as Ki-joon, alongside Beom-soo Lee, Joon-ho He… [+962 chars]","Webtoon-Based Action Noir Live-Action Show Mercy for None to Premiere on Netflix June 6 Streaming company also unveils teaser poster, English-subtitled trailer",0.9999983732155329
Netflix,2025-05-11,PC Gamer,"Black Mirror's interactive episode Bandersnatch is being removed from Netflix, as 'the technology has served its purpose'",Bandersnatch gets snatched from the service after the weekend.,https://www.pcgamer.com/games/adventure/black-mirrors-interactive-episode-bandersnatch-is-being-removed-from-netflix-as-the-technology-has-served-its-purpose/,"Black Mirror: Bandersnatch, the anthology's interactive, choose-your-own (miserable) TV adventure, is being removed from Netflix on Monday, meaning you've got just a few more days to sample the serie… [+2779 chars]","Black Mirror's interactive episode Bandersnatch is being removed from Netflix, as 'the technology has served its purpose' Bandersnatch gets snatched from the service after the weekend.",0.9585523061978165
Netflix,2025-05-11,MobileSyrup,"Streaming in Canada on Apple TV+, Crave, Disney+, Netflix and Prime Video [May 12-18]","Wondering what to watch on streaming? Every week, MobileSyrup outlines some of the most notable new movies and TV shows. We typically focus on new content from Amazon’s Prime Video, Crave, Disney+ and Netflix, but other services like Apple TV+ and Paramount+ …",https://mobilesyrup.com/2025/05/11/streaming-in-canada-on-apple-tv-crave-disney-netflix-and-prime-video-may-12-18-super-team-canada/,"Wondering what to watch on streaming?
Every week, MobileSyrup outlines some of the most notable new movies and TV shows. We typically focus on new content from Amazons Prime Video, Crave, Disney+ an… [+5201 chars]","Streaming in Canada on Apple TV+, Crave, Disney+, Netflix and Prime Video [May 12-18] Wondering what to watch on streaming? Every week, MobileSyrup outlines some of the most notable new movies and TV shows. We typically focus on new content from Amazon’s Prime Video, Crave, Disney+ and Netflix, but other services like Apple TV+ and Paramount+ …",0.999999283559788
Netflix,2025-05-11,Dark Horizons,Netflix Removes Their Last Interactive Specials,Netflix have confirmed that the final two interactive specials they still have on their service will disappear from the platform this coming Monday. What’s on Netflix reports that both “Black Mirror: Bandersnatch” and “Unbreakable Kimmy Schmidt: Kimmy vs. the…,https://www.darkhorizons.com/netflix-removes-their-last-interactive-specials/,"Netflix have confirmed that the final two interactive specials they still have on their service will disappear from the platform this coming Monday.
What’s on Netflix reports that both “Black Mirror… [+1222 chars]",Netflix Removes Their Last Interactive Specials Netflix have confirmed that the final two interactive specials they still have on their service will disappear from the platform this coming Monday. What’s on Netflix reports that both “Black Mirror: Bandersnatch” and “Unbreakable Kimmy Schmidt: Kimmy vs. the…,0.9995744452153303
Netflix,2025-05-11,CinemaBlend,Viewers Are Loving Vince Vaughn’s Brand New Netflix Movie – And It’s A Rare Case Where The Fan And Critics Scores Are Only 3% Apart,This doesn't happen all that often!,https://www.cinemablend.com/streaming-news/viewers-loving-vince-vaughn-netflix-movie-nonnas-rare-case-fan-critics-scores-close,"The 2025 movie schedule is rolling right along, and a number of titles have struck a chord with cinephiles. Days ago, such a film just became available to Netflix subscription holders, and it’s the V… [+3009 chars]",Viewers Are Loving Vince Vaughn’s Brand New Netflix Movie – And It’s A Rare Case Where The Fan And Critics Scores Are Only 3% Apart This doesn't happen all that often!,0.8356719268485904
Netflix,2025-05-11,ComicBook.com,Everything Coming to Netflix This Week (May 12th),"Netflix is following Mother’s Day with a busy week of new movie and TV additions, bringing more entertainment to subscribers as we make our way into the middle of May. Starting Monday, the streaming service has five consecutive days of programming already pla…",http://comicbook.com/tv-shows/news/netflix-new-movies-tv-shows-streaming-this-week-may-12/,"Netflix is following Mother’s Day with a busy week of new movie and TV additions, bringing more entertainment to subscribers as we make our way into the middle of May. Starting Monday, the streaming … [+3904 chars]","Everything Coming to Netflix This Week (May 12th) Netflix is following Mother’s Day with a busy week of new movie and TV additions, bringing more entertainment to subscribers as we make our way into the middle of May. Starting Monday, the streaming service has five consecutive days of programming already pla…",0.9959831542801112
AMD,2025-05-11,Business Insider,"A guide to Nvidia's competitors: AMD, Qualcomm, Broadcom, startups, and more are vying to compete in the AI chip market","Despite Nvidia's AI semiconductor dominance, competitors are innovating to challenge its lead. Read about AMD, Qualcomm, Broadcom, Amazon, and more.",https://www.businessinsider.com/nvidia-competitors,"Nvidia CEO Jensen Huang and his team got an early foothold in the AI chip market — but now, they have competition.I-Hwa Cheng/AFP/Getty Images
<ul><li>Nvidia dominates the AI semiconductor market.</… [+5915 chars]","A guide to Nvidia's competitors: AMD, Qualcomm, Broadcom, startups, and more are vying to compete in the AI chip market Despite Nvidia's AI semiconductor dominance, competitors are innovating to challenge its lead. Read about AMD, Qualcomm, Broadcom, Amazon, and more.",0.7288311794400215
AMD,2025-05-11,Phoronix,"GSoC 2025 Projects: AI-Powered Log Analyzer For Fedora, Better AMD ROCm On Debian","This week Google announced all of the accepted projects for this year's Google Summer of Code (GSoC). There are 1,272 accepted students/projects this year for student developers working on various interesting open-source efforts over the summer...",https://www.phoronix.com/news/GSoC-2025-Projects,"This week Google announced all of the accepted projects for this year's Google Summer of Code (GSoC). There are 1,272 accepted students/projects this year for student developers working on various in… [+3421 chars]","GSoC 2025 Projects: AI-Powered Log Analyzer For Fedora, Better AMD ROCm On Debian This week Google announced all of the accepted projects for this year's Google Summer of Code (GSoC). There are 1,272 accepted students/projects this year for student developers working on various interesting open-source efforts over the summer...",0.9782813023775816
AMD,2025-05-11,Phoronix,Linux 6.15 Fix Merged For Sizable Performance Regression On Newer AMD CPUs,At the end of April I reported on a significant performance regression affecting newer AMD CPUs and was bisected to a change in the AMD SRSO mitigation handling for Zen 4/5 processors with the Linux 6.15 kernel. The fix for that significant performance regres…,https://www.phoronix.com/news/Linux-6.15-Fixes-AMD-Perf,"After spotting a sizable performance regression earlier in April, this AMD performance regression affecting newer AMD processors ended up being quite significant. Simply if the KVM kernel module for … [+1610 chars]",Linux 6.15 Fix Merged For Sizable Performance Regression On Newer AMD CPUs At the end of April I reported on a significant performance regression affecting newer AMD CPUs and was bisected to a change in the AMD SRSO mitigation handling for Zen 4/5 processors with the Linux 6.15 kernel. The fix for that significant performance regres…,0.9987129841174465
AMD,2025-05-11,Tom's Hardware UK,"Tiny Corp heralds world's first AMD GPU driven via USB3 — eGPUs tested on Apple Silicon, with Linux and Windows also supported","Tiny Corp has achieved the world's first eGPU operating in Tiny Grad over USB3, with compatibility across macOS, Windows, and Linux.",https://www.tomshardware.com/pc-components/gpus/tiny-corp-heralds-worlds-first-amd-gpu-driven-via-usb3-egpus-tested-on-apple-silicon-with-linux-and-windows-also-supported,"External GPU (eGPU) support on Apple Silicon Macs and MacBooks has been a persistent pain point for AI/ML developers. Through what some may consider to be black magic, Tiny Corp has managed to get an… [+2946 chars]","Tiny Corp heralds world's first AMD GPU driven via USB3 — eGPUs tested on Apple Silicon, with Linux and Windows also supported Tiny Corp has achieved the world's first eGPU operating in Tiny Grad over USB3, with compatibility across macOS, Windows, and Linux.",-0.9934697784483433
AMD,2025-05-11,Ozbargain.com.au,Bosgame Mini PC AMD 6800H 24GB Ram 1TB $539 @ Amazon,Add coupon for $180 off Seems like a decent setup after the recent Kamrui deal https://www.ozbargain.com.au/node/903727 Not sure how long the coupon will last,https://www.ozbargain.com.au/node/905326,"All trademarks are owned by their respective owners.OzBargain is an independent community website which has no association with nor endorsement by the respective trademark owners.
Copyright © 2006-2… [+32 chars]",Bosgame Mini PC AMD 6800H 24GB Ram 1TB $539 @ Amazon Add coupon for $180 off Seems like a decent setup after the recent Kamrui deal https://www.ozbargain.com.au/node/903727 Not sure how long the coupon will last,0.6123769134283066
AMD,2025-05-11,Ozbargain.com.au,64GB CORSAIR DDR5 (2x32gb) 6000MHz CL30 AMD Expo $241.45 Delivered @ Amazon.com.au,Cheapest price for 64Gbs in a long time. If you need 64Gb DDR5 6000 CL30 get this asap. It will sell out quick. Sub timings are also the best you can get. Info. CORSAIR Vengeance DDR5 RAM 64GB …,https://www.ozbargain.com.au/node/905260,"This post contains affiliate links. OzBargain might earn commissions when you click through and make purchases. Please see this page for more information.
Cheapest price for 64Gbs in a long time. If… [+263 chars]",64GB CORSAIR DDR5 (2x32gb) 6000MHz CL30 AMD Expo $241.45 Delivered @ Amazon.com.au Cheapest price for 64Gbs in a long time. If you need 64Gb DDR5 6000 CL30 get this asap. It will sell out quick. Sub timings are also the best you can get. Info. CORSAIR Vengeance DDR5 RAM 64GB …,-0.9824532708153129
AMD,2025-05-11,Biztoc.com,China Export Controls Whack AMD Datacenter GPU Business,"As far as we can tell, the export controls on crippled GPU compute engines announced by the US Department of Commerce back in April have had a disproportionately hard impact on AMD compared to Nvidia, as far as we can tell. These controls did not affect AMD’s…",https://biztoc.com/x/da5b8be549ce8ccd,"As far as we can tell, the export controls on crippled GPU compute engines announced by the US Department of Commerce back in April have had a disproportionately hard impact on AMD compared to Nvidia… [+152 chars]","China Export Controls Whack AMD Datacenter GPU Business As far as we can tell, the export controls on crippled GPU compute engines announced by the US Department of Commerce back in April have had a disproportionately hard impact on AMD compared to Nvidia, as far as we can tell. These controls did not affect AMD’s…",0.06365742196794599
AMD,2025-05-11,ETF Daily News,What is Northland Capmk’s Forecast for AMD Q1 Earnings?,"Advanced Micro Devices, Inc. (NASDAQ:AMD – Free Report) – Research analysts at Northland Capmk reduced their Q1 2026 EPS estimates for Advanced Micro Devices in a research note issued to investors on Wednesday, May 7th. Northland Capmk analyst G. Richard now …",https://www.etfdailynews.com/2025/05/11/what-is-northland-capmks-forecast-for-amd-q1-earnings/,"Advanced Micro Devices, Inc. (NASDAQ:AMD – Free Report) – Research analysts at Northland Capmk reduced their Q1 2026 EPS estimates for Advanced Micro Devices in a research note issued to investors on… [+5352 chars]","What is Northland Capmk’s Forecast for AMD Q1 Earnings? Advanced Micro Devices, Inc. (NASDAQ:AMD – Free Report) – Research analysts at Northland Capmk reduced their Q1 2026 EPS estimates for Advanced Micro Devices in a research note issued to investors on Wednesday, May 7th. Northland Capmk analyst G. Richard now …",0.029533745590470062
