ticker,date,source,title,description,url,content,text,sentiment
Netflix,2025-05-10,Motorsport.com,"NASCAR Full Speed on Netflix review: What hit, and what missed",NASCAR's Netflix docuseries pulls back the curtain on several of the sport's stars while they participate in the battle for the Cup Series title,https://www.motorsport.com/nascar-cup/news/nascar-full-speed-review-what-the-netflix-series-did-well-and-wrong/10721444/,"Season 2 of NASCAR's Netflix docuseries, NASCAR Full Speed, has officially dropped all five episodes are now available for streaming. Once again, it focuses in on the playoffs and the 16 drivers figh… [+7405 chars]","NASCAR Full Speed on Netflix review: What hit, and what missed NASCAR's Netflix docuseries pulls back the curtain on several of the sport's stars while they participate in the battle for the Cup Series title",0.9985417368880007
Netflix,2025-05-10,ComicBook.com,Prime Video Adds One of Its Best Movies So Far This Year (Right as it Leaves Netflix),"Amazon Prime Video just added one of its best movies so far this year, right after it was removed from Netflix. After its big dump on May 1, movies and TV shows continue to trickle to Prime Video this month. For example, on May 5, Prime Video was updated with…",http://comicbook.com/movies/news/amazon-prime-video-netflix-movie-peanut-butter-falcon/,"Amazon Prime Video just added one of its best movies so far this year, right after it was removed from Netflix. After its big dump on May 1, movies and TV shows continue to trickle to Prime Video thi… [+2159 chars]","Prime Video Adds One of Its Best Movies So Far This Year (Right as it Leaves Netflix) Amazon Prime Video just added one of its best movies so far this year, right after it was removed from Netflix. After its big dump on May 1, movies and TV shows continue to trickle to Prime Video this month. For example, on May 5, Prime Video was updated with…",0.9821041251998395
Netflix,2025-05-10,Livemint,The Royals on Netflix: Money lessons hidden behind diamond tantrums and supercars,"The royal family faces financial challenges after Milind Soman's death, leading to an effort to make their estate viable. Young maharaja Ishaan Khattar struggles with responsibilities while Sophie aims to prove herself through startup investments in the royal…",https://www.livemint.com/money/personal-finance/the-royals-on-netflix-money-lessons-hidden-behind-diamond-tantrums-and-supercars-bhumi-pednekar-ishaan-khatter-11746857192855.html,A dead Milind Soman still makes his presence felt Hes left his money to Maurice. Who is Maurice? The family needs to tighten its royal belt and learn to accept responsibilities. Ishaan Khattar plays … [+3841 chars],"The Royals on Netflix: Money lessons hidden behind diamond tantrums and supercars The royal family faces financial challenges after Milind Soman's death, leading to an effort to make their estate viable. Young maharaja Ishaan Khattar struggles with responsibilities while Sophie aims to prove herself through startup investments in the royal…",6.51050788746943e-06
Netflix,2025-05-10,Biztoc.com,Netflix series 'Forever' is a tender retelling of the struggles of young love,The Netflix adaptation of Judy Blume’s 'Forever…' is still a groundbreaking and frank examination of teenage sex and first love.,https://biztoc.com/x/32c26c3069478e3d,"The Netflix adaptation of Judy Blumes 'Forever' is still a groundbreaking and frank examination of teenage sex and first love.
This story appeared on msnbc.com, 2025-05-10 14:03:33.",Netflix series 'Forever' is a tender retelling of the struggles of young love The Netflix adaptation of Judy Blume’s 'Forever…' is still a groundbreaking and frank examination of teenage sex and first love.,0.983400025870651
Netflix,2025-05-10,The Times of India,Korean Dramas release dates on Netflix: New K-Dramas dropping this June. Is your couch ready?,"Netflix is releasing a lineup of K-dramas this June 2025, revenge in Mercy for None, deadly games in Squid Game 3, romance in Tastefully Yours, and twin chaos in Our Unwritten Seoul.",https://economictimes.indiatimes.com/news/international/us/korean-dramas-release-dates-on-netflix-new-k-dramas-dropping-this-june-is-your-couch-ready/articleshow/121066307.cms,"(Catch all the US News, UK News, Canada News, International Breaking News Events, and Latest News Updates on The Economic Times.)
Download The Economic Times News App to get Daily International News… [+8 chars]","Korean Dramas release dates on Netflix: New K-Dramas dropping this June. Is your couch ready? Netflix is releasing a lineup of K-dramas this June 2025, revenge in Mercy for None, deadly games in Squid Game 3, romance in Tastefully Yours, and twin chaos in Our Unwritten Seoul.",0.9999921431606253
AMD,2025-05-10,Tom's Hardware UK,AMD RX 9060 XT GPU retailer listings start at $450,"We don't have official pricing yet from AMD, but according to various retailer listings, this will likely be the price range of the GPUs from AIB partners.",https://www.tomshardware.com/pc-components/gpus/amd-rx-9060-xt-gpu-retailer-listings-start-at-usd450,"Online listings for AMD Radeon RX 9060 XT have started appearing online, with the GPU showing up on Amazon and another Swiss retailer. According to VideoCardz, XFX put up two versions of the 9060 XT … [+2190 chars]","AMD RX 9060 XT GPU retailer listings start at $450 We don't have official pricing yet from AMD, but according to various retailer listings, this will likely be the price range of the GPUs from AIB partners.",0.9999966697758111
AMD,2025-05-10,Tom's Hardware UK,AMD 6th Gen EPYC 9006 Venice CPUs reportedly offer up to 96 Zen 6 or 256 Zen 6c cores,"New details allege AMD's next-generation Zen 6 dense CCDs will carry up to 32 cores and 128MB of L3 cache, with 12 cores and 48MB for the standard CCDs.",https://www.tomshardware.com/pc-components/cpus/amd-6th-gen-epyc-9006-venice-cpus-reportedly-offer-up-to-96-zen-6-or-256-zen-6c-cores,"Specifications for AMD's next-generation Zen 6-based server products have surfaced at Baidu, via HXL at X. Venice, the successor to AMD's current Turin server offerings, will reportedly pack as many … [+3197 chars]","AMD 6th Gen EPYC 9006 Venice CPUs reportedly offer up to 96 Zen 6 or 256 Zen 6c cores New details allege AMD's next-generation Zen 6 dense CCDs will carry up to 32 cores and 128MB of L3 cache, with 12 cores and 48MB for the standard CCDs.",0.9824766265228391
AMD,2025-05-10,TechSpot,"New AMD Radeon RX 9060 XT info reveals high boost clocks, possible price tiers","A VideoCardz reader recently spotted two XFX Swift graphics cards listed on Amazon sporting the upcoming Radeon RX 9060 XT. Priced at $449 for the 8GB model and $519 for the 16GB version, the now-removed listings point to pricing comparable to Nvidia's RTX 50…",https://www.techspot.com/news/107870-new-amd-radeon-rx-9060-xt-info-reveals.html,"Editor's take: AMD's Radeon RX 9060 XT is expected to launch in about a week, but pricing remains unclear. An early Amazon listing suggests it won't undercut Nvidia's competing RTX 5060 Ti, though th… [+2566 chars]","New AMD Radeon RX 9060 XT info reveals high boost clocks, possible price tiers A VideoCardz reader recently spotted two XFX Swift graphics cards listed on Amazon sporting the upcoming Radeon RX 9060 XT. Priced at $449 for the 8GB model and $519 for the 16GB version, the now-removed listings point to pricing comparable to Nvidia's RTX 50…",0.9997030952072237
AMD,2025-05-10,TechRadar,"Chinese PC vendor you've probably never heard of just unveiled the biggest rival to Nvidia's DGX Spark AI workstation, one that uses AMD and can be clustered","Beelink’s GTR9 Pro is a compact powerhouse for AI, gaming, and creative work, featuring 126 TOPS performance and whisper-quiet operation.",https://www.techradar.com/pro/chinese-pc-vendor-you-probably-never-heard-of-just-unveiled-the-biggest-rival-to-nvidias-dgx-spark-ai-workstation,<ul><li>Beelink’s GTR9 Pro runs a Ryzen AI Max+ 395 processor and delivers 126 TOPS for next-gen AI</li><li>Dual 10Gbps Ethernet ports mean lightning-fast clustering and insane data transfer speeds</… [+2061 chars],"Chinese PC vendor you've probably never heard of just unveiled the biggest rival to Nvidia's DGX Spark AI workstation, one that uses AMD and can be clustered Beelink’s GTR9 Pro is a compact powerhouse for AI, gaming, and creative work, featuring 126 TOPS performance and whisper-quiet operation.",0.997763717896305
AMD,2025-05-10,ETF Daily News,Advanced Micro Devices’ (AMD) Overweight Rating Reiterated at Cantor Fitzgerald,"Cantor Fitzgerald reiterated their overweight rating on shares of Advanced Micro Devices (NASDAQ:AMD – Free Report) in a research report released on Wednesday,Benzinga reports. Cantor Fitzgerald currently has a $120.00 price target on the semiconductor manufa…",https://www.etfdailynews.com/2025/05/10/advanced-micro-devices-amd-overweight-rating-reiterated-at-cantor-fitzgerald/,"Cantor Fitzgerald reiterated their overweight rating on shares of Advanced Micro Devices (NASDAQ:AMD – Free Report) in a research report released on Wednesday,Benzinga reports. Cantor Fitzgerald curr… [+5598 chars]","Advanced Micro Devices’ (AMD) Overweight Rating Reiterated at Cantor Fitzgerald Cantor Fitzgerald reiterated their overweight rating on shares of Advanced Micro Devices (NASDAQ:AMD – Free Report) in a research report released on Wednesday,Benzinga reports. Cantor Fitzgerald currently has a $120.00 price target on the semiconductor manufa…",-0.9982414441765286
AMD,2025-05-10,ETF Daily News,Advanced Micro Devices’ (AMD) Outperform Rating Reiterated at Raymond James,"Raymond James reaffirmed their outperform rating on shares of Advanced Micro Devices (NASDAQ:AMD – Free Report) in a research report sent to investors on Wednesday morning,Benzinga reports. They currently have a $120.00 price objective on the semiconductor ma…",https://www.etfdailynews.com/2025/05/10/advanced-micro-devices-amd-outperform-rating-reiterated-at-raymond-james/,"Raymond James reaffirmed their outperform rating on shares of Advanced Micro Devices (NASDAQ:AMD – Free Report) in a research report sent to investors on Wednesday morning,Benzinga reports. They curr… [+5395 chars]","Advanced Micro Devices’ (AMD) Outperform Rating Reiterated at Raymond James Raymond James reaffirmed their outperform rating on shares of Advanced Micro Devices (NASDAQ:AMD – Free Report) in a research report sent to investors on Wednesday morning,Benzinga reports. They currently have a $120.00 price objective on the semiconductor ma…",-0.9999966650204897
AMD,2025-05-10,Dealcatcher.com,"Office Depot - HP 15.6"" Laptop, AMD Ryzen 7, AI Enabled, 16GB RAM, 256GB SSD, Wi-Fi 6, Windows 11 $519.99","HP 15.6"" Laptop, AMD Ryzen 7, AI Enabled, 16GB RAM, 256GB SSD, Wi-Fi 6, Windows 11",https://www.dealcatcher.com/deals/computers-office/laptops/hp-amd-ryzen-ai-wi-fi-windows-998446498,"<ul><li>The current price of $519.99 is significantly below the stated original price of $809.99, representing a substantial discount.</li><li>HP is a well-known and generally trusted brand for consu… [+616 chars]","Office Depot - HP 15.6"" Laptop, AMD Ryzen 7, AI Enabled, 16GB RAM, 256GB SSD, Wi-Fi 6, Windows 11 $519.99 HP 15.6"" Laptop, AMD Ryzen 7, AI Enabled, 16GB RAM, 256GB SSD, Wi-Fi 6, Windows 11",0.9999167540627241
Palantir,2025-05-10,Biztoc.com,Prediction: Palantir Will Be a Trillion-Dollar Company in 2030,"In This Article:
Key Points
-
Palantir stock fell following its latest quarterly report, but this looks like an opportunity for growth investors.
-
The fast-growing AI company not only beat expectations but also raised its 2025 guidance.
-
Palantir is expecte…",https://biztoc.com/x/8cbf4d19401e2fa8,"In This Article:Key Points-Palantir stock fell following its latest quarterly report, but this looks like an opportunity for growth investors.-The fast-growing AI company not only beat expectations b… [+145 chars]","Prediction: Palantir Will Be a Trillion-Dollar Company in 2030 In This Article:
Key Points
-
Palantir stock fell following its latest quarterly report, but this looks like an opportunity for growth investors.
-
The fast-growing AI company not only beat expectations but also raised its 2025 guidance.
-
Palantir is expecte…",-0.9999999510053357
Palantir,2025-05-10,Biztoc.com,Trader Suggests Potential Bullish Options Strategies Involving Palantir Technologies (PLTR) Stock,"Scott Bauer, appearing on Schwab Network yesterday, suggested potential bullish options strategies involving Palantir Technologies (PLTR) stock in the wake of its first-quarter earnings report.
Bauer is the CEO of the Prosper Trading Academy.
On the same segm…",https://biztoc.com/x/471923f34a0f86e2,"Scott Bauer, appearing on Schwab Network yesterday, suggested potential bullish options strategies involving Palantir Technologies (PLTR) stock in the wake of its first-quarter earnings report.Bauer … [+141 chars]","Trader Suggests Potential Bullish Options Strategies Involving Palantir Technologies (PLTR) Stock Scott Bauer, appearing on Schwab Network yesterday, suggested potential bullish options strategies involving Palantir Technologies (PLTR) stock in the wake of its first-quarter earnings report.
Bauer is the CEO of the Prosper Trading Academy.
On the same segm…",0.9134928807616234
Palantir,2025-05-10,Biztoc.com,"Dow Jones Futures: U.S.-China Trade Talks Underway; Tesla, Palantir, Alibaba Near Buy Points","Dow Jones futures will open Sunday evening, along with S&P 500 futures and Nasdaq futures. U.S.-China trade talks have begun, with hopes for a big tariff reduction. The stock market rally saw small weekly losses on the major indexes, still rangebound despite …",https://biztoc.com/x/f1bcca91753626a4,"Dow Jones futures will open Sunday evening, along with S&amp;P 500 futures and Nasdaq futures. U.S.-China trade talks have begun, with hopes for a big tariff reduction. The stock market rally saw sma… [+144 chars]","Dow Jones Futures: U.S.-China Trade Talks Underway; Tesla, Palantir, Alibaba Near Buy Points Dow Jones futures will open Sunday evening, along with S&P 500 futures and Nasdaq futures. U.S.-China trade talks have begun, with hopes for a big tariff reduction. The stock market rally saw small weekly losses on the major indexes, still rangebound despite …",-0.007574602961540222
Palantir,2025-05-10,Biztoc.com,Analyst Explains Why the Valuation of Palantir Technologies (PLTR) Stock Is So High,"In This Article:
Appearing on Yahoo Finance in the wake of Palantir Technologies (PLTR)'s first quarter earnings report, Third Bridge Forum Senior Analyst Jordan Berger explained why he believes that Palantir Technologies (PLTR) has such an extraordinarily hi…",https://biztoc.com/x/b4e48845c76fd923,"In This Article:Appearing on Yahoo Finance in the wake of Palantir Technologies (PLTR)'s first quarter earnings report, Third Bridge Forum Senior Analyst Jordan Berger explained why he believes that … [+151 chars]","Analyst Explains Why the Valuation of Palantir Technologies (PLTR) Stock Is So High In This Article:
Appearing on Yahoo Finance in the wake of Palantir Technologies (PLTR)'s first quarter earnings report, Third Bridge Forum Senior Analyst Jordan Berger explained why he believes that Palantir Technologies (PLTR) has such an extraordinarily hi…",-0.8956509754061699
Palantir,2025-05-10,Biztoc.com,Prediction: 2 Unstoppable Growth Stocks That Will Be Worth More Than Palantir 1 Year From Now,"In This Article:
Key Points
-
Palantir has soared 1,760% since the start of 2023.
-
Its valuation is incredibly lofty, which makes the downside risk for the stock very high.
-
These two stocks trade at more reasonable values while exhibiting very strong earni…",https://biztoc.com/x/032b881297e4c64e,"In This Article:Key Points-Palantir has soared 1,760% since the start of 2023.-Its valuation is incredibly lofty, which makes the downside risk for the stock very high.-These two stocks trade at more… [+144 chars]","Prediction: 2 Unstoppable Growth Stocks That Will Be Worth More Than Palantir 1 Year From Now In This Article:
Key Points
-
Palantir has soared 1,760% since the start of 2023.
-
Its valuation is incredibly lofty, which makes the downside risk for the stock very high.
-
These two stocks trade at more reasonable values while exhibiting very strong earni…",-0.999999134625412
Palantir,2025-05-10,Biztoc.com,Palantir and 29 Other Stocks for the Next Phase of the AI Trade,,https://biztoc.com/x/4ba380304d797bd8,"{ window.open(this.href, '_blank'); }, 200); return false;""&gt;Why did India and Pakistan agree to a ceasefire? { window.open(this.href, '_blank'); }, 200); return false;""&gt;How will US-China trade … [+936 chars]",Palantir and 29 Other Stocks for the Next Phase of the AI Trade ,0.9999889878776003
Palantir,2025-05-10,Biztoc.com,"After Soaring 361% in Just 1 Year, Can Palantir Stock Keep Climbing? History Offers a Clear Answer","In This Article:
Key Points
-
Palantir Technologies has been one of the best-performing stocks in the S&P 500 and Nasdaq-100 over the last year.
-
While enthusiasm over Palantir's AI opportunities have driven its stock to new heights, investors should look cl…",https://biztoc.com/x/4b67d109bd8b4b82,In This Article:Key Points-Palantir Technologies has been one of the best-performing stocks in the S&amp;P 500 and Nasdaq-100 over the last year.-While enthusiasm over Palantir's AI opportunities hav… [+144 chars],"After Soaring 361% in Just 1 Year, Can Palantir Stock Keep Climbing? History Offers a Clear Answer In This Article:
Key Points
-
Palantir Technologies has been one of the best-performing stocks in the S&P 500 and Nasdaq-100 over the last year.
-
While enthusiasm over Palantir's AI opportunities have driven its stock to new heights, investors should look cl…",-0.999999995655207
Google,2025-05-09,BBC News,Mexico sues Google over 'Gulf of America' name change,President Sheinbaum argues Trump's executive order applies only to the US portion of the continental shelf.,https://www.bbc.com/news/articles/c5yk5nj7p7ko,"Mexico is suing Google for ignoring repeated requests not to call the Gulf of Mexico the Gulf of America on Google Maps for US users, President Claudia Sheinbaum says. 
She did not say where the law… [+1955 chars]",Mexico sues Google over 'Gulf of America' name change President Sheinbaum argues Trump's executive order applies only to the US portion of the continental shelf.,0.9930238182114408
Google,2025-05-09,Android Central,Gemini Live is finally arriving on enterprise Google accounts for work and school,"Gemini Live has been in the hands of Android users for months, but users with Google Workspace accounts couldn't access the feature until now.",https://www.androidcentral.com/apps-software/ai/gemini-live-is-finally-arriving-on-enterprise-google-accounts-for-work-and-school,"What you need to know
<ul><li>Gemini Live is rolling out for work and school users on Google Workspace domains.</li><li>The feature is automatically enabled when Gemini access is available, and Gemi… [+2964 chars]","Gemini Live is finally arriving on enterprise Google accounts for work and school Gemini Live has been in the hands of Android users for months, but users with Google Workspace accounts couldn't access the feature until now.",0.9999800012310516
Google,2025-05-09,Android Central,Google calls the US Department of Justice's proposed antitrust remedies 'extreme',"The U.S. wants Google to stop making deals to lift up its search engine, and wants to force a sale of its Chrome browser. Here's what Google has to say in response.",https://www.androidcentral.com/apps-software/google-calls-the-us-department-of-justices-antitrust-remedies-extreme,"What you need to know
<ul><li>The U.S. DOJ won its antitrust case against Google, but the two sides recently finished their remedies hearing, where each made their case as to what changes Google sho… [+3181 chars]","Google calls the US Department of Justice's proposed antitrust remedies 'extreme' The U.S. wants Google to stop making deals to lift up its search engine, and wants to force a sale of its Chrome browser. Here's what Google has to say in response.",0.9962038690937334
Google,2025-05-09,Android Police,Google Messages will finally let you unsend that embarrassing text,"A ""Delete for everyone"" option is showing up for Google Messages users on the beta channel",https://www.androidpolice.com/google-messages-finally-let-you-unsend-embarrassing-text/,"Summary
<ul><li>
 Google Messages rolling out a 'Delete for everyone' option for select users on the beta channel.
 </li><li>
 Users will have a 15-minute window to unsend messages.
 </li><li>
… [+2338 chars]","Google Messages will finally let you unsend that embarrassing text A ""Delete for everyone"" option is showing up for Google Messages users on the beta channel",0.9999155126679398
Google,2025-05-09,Android Police,Google argues Chrome would be 'insecure and obsolete' if broken up,Chrome's fate is uncertain for now,https://www.androidpolice.com/googles-argument-against-dojs-extreme-remedy-proposals/,"Summary
<ul><li>
 Google has been found to be an illegal monopolist in the US for its practices in the search engine and online advertising markets, leading to potential remedies, including the DOJ… [+3950 chars]",Google argues Chrome would be 'insecure and obsolete' if broken up Chrome's fate is uncertain for now,0.024147156884282595
Google,2025-05-09,Phandroid - News for Android,Save up to $100 with this Google Pixel Tablet Deal!,"It comes bundled with the magnetic speaker dock as well.
The post Save up to $100 with this Google Pixel Tablet Deal! appeared first on Phandroid.",https://phandroid.com/2025/05/09/save-up-to-100-with-this-google-pixel-tablet-deal/,"If you’re looking for an Android tablet that covers all the basics including a large display, battery and seamless software, then you might want to check out this deal on the Google Pixel Tablet. On … [+673 chars]","Save up to $100 with this Google Pixel Tablet Deal! It comes bundled with the magnetic speaker dock as well.
The post Save up to $100 with this Google Pixel Tablet Deal! appeared first on Phandroid.",-0.07401058077812195
Google,2025-05-09,Phandroid - News for Android,How to use Google Circle to Search on iPhone,"Now, you can use the magic of Google Circle to Search on your iPhone too.
The post How to use Google Circle to Search on iPhone appeared first on Phandroid.",https://phandroid.com/2025/05/09/how-to-use-google-circle-to-search-on-iphone/,"Circle to Search is a new Google feature that makes it super convenient to search for anything that you see on the screen. Its purpose is the same as Google Lens, but it is the way you search differs… [+1735 chars]","How to use Google Circle to Search on iPhone Now, you can use the magic of Google Circle to Search on your iPhone too.
The post How to use Google Circle to Search on iPhone appeared first on Phandroid.",0.9999592580734316
Google,2025-05-09,Windows Central,"Sam Altman says ""I don't do Google searches anymore"" — but admits ChatGPT won't be Google's killer","OpenAI CEO Sam Altman recently indicated that ChatGPT won't replace Google as the primary search engine, citing the company's vast resources and talented AI team as the main reasons.",https://www.windowscentral.com/software-apps/browsing/sam-altman-says-i-dont-do-google-searches-anymore-but-admits-chatgpt-wont-be-googles-killer,"Last year, a former Google engineer indicated that the company might have bigger fish to fry with the emergence of AI-powered search engines beyond the antitrust ruling that deemed it an illegal mono… [+1874 chars]","Sam Altman says ""I don't do Google searches anymore"" — but admits ChatGPT won't be Google's killer OpenAI CEO Sam Altman recently indicated that ChatGPT won't replace Google as the primary search engine, citing the company's vast resources and talented AI team as the main reasons.",0.08692538738250732
Google,2025-05-09,Android Authority,Google Messages begins rolling out “Delete for Everyone” feature,"Google Messages appears to have started rolling out the new ""Delete for Everyone"" option in group RCS chats for beta users.",https://www.androidauthority.com/google-messages-delete-for-everyone-beta-rollout-3555908/,<ul><li>Google Messages seems to have started rolling out the Delete for Everyone option in group chats for beta users.</li><li>The feature allows users to delete messages sent to everyone in the gro… [+1894 chars],"Google Messages begins rolling out “Delete for Everyone” feature Google Messages appears to have started rolling out the new ""Delete for Everyone"" option in group RCS chats for beta users.",0.9998865237866994
Microsoft,2025-05-09,Windows Central,Overwatch 2 developers at Blizzard Entertainment form union under Microsoft,"The Overwatch 2 team at Blizzard Entertainment has formed a ""wall-to-wall"" union under Microsoft.",https://www.windowscentral.com/gaming/xbox/overwatch-2-team-union-blizzard-entertainment-microsoft,"The Overwatch 2 development team at Blizzard Entertainment has unionized, as shared by the Communication Workers of America (CWA) on Friday.
This ""wall-to-wall"" union includes almost 200 developers,… [+1580 chars]","Overwatch 2 developers at Blizzard Entertainment form union under Microsoft The Overwatch 2 team at Blizzard Entertainment has formed a ""wall-to-wall"" union under Microsoft.",0.9999766980970435
